id,employer_id,name,employer,area,published_at,salary_from,salary_to,salary_currency,experience,employment,schedule,key_skills,description,specializations,url,fetched_at
125407954,10933459,Финансовый менеджер (финансовый аналитик),RESTORER HOME,Москва,2025-09-16T18:21:44+0300,,,,От 3 до 6 лет,Полная занятость,Удаленная работа,"['Анализ данных', 'Анализ бизнес показателей', 'Сбор и анализ информации', 'Планирование', 'Финансовое моделирование', 'Формирование бюджета', 'Бюджетирование', 'Финансовый контроль', 'Финансовый менеджмент']","<p><strong>Ресторер Хоум - быстрорастущая строительная компания, ищем в команду финансового менеджера-аналитики для построения эффективной бизнес-модели и совместного развития и роста.</strong></p> <p> </p> <p><strong>Обязанности:</strong></p> <ul> <li>Проверка правильности отражения операций в управленческом учете, сверка данных с бухгалтерским учетом;</li> <li>Ежедневное разнесение информации о поступлениях/расходовании денежных средств на статьи ДДС/БДР;</li> </ul> <p><strong>Составление отчетов:</strong></p> <ul> <li>ДДС;</li> <li>P&amp;L;</li> <li>Расчет себестоимости;</li> <li>Составление платежного календаря;</li> <li>Составление и исполнение бюджета;</li> <li>Контроль своевременности получения информации от смежных подразделений, загрузка данных в базу 1С, проверка корректности сформированных документов;</li> <li>Участие в проектах постановки управленческого учета;</li> <li>Участие в проектах автоматизации учета и отчетности;</li> <li>Дебиторская задолженность.</li> <li> <p>Сбор данных из различных источников (1С, Битрикс24, Excel-реестры) и формирование регулярного (ежемесячного) P&amp;L компании.</p> </li> <li> <p>Анализ и прогнозирование денежных потоков, выявление потенциальных кассовых разрывов.</p> </li> <li> <p>Создание и поддержка управленческих дашбордов для руководства (в Excel/Google Sheets, а в перспективе - в BI-системе) с ключевыми финансовыми и операционными метриками.</p> </li> </ul> <p><strong>Требования:</strong></p> <ul> <li>Финансово-экономическое или бухгалтерское образование.</li> <li>Опыт работы на аналогичной позиции;</li> <li>Опыт построения управленческой отчетности с нуля - ВАЖНО;</li> <li>Уверенный пользователь: 1C.Управление торговлей(УТ), 1C.Предприятие,Excel, Word.</li> <li>Обязательное знание Excel;</li> <li>Обязательное знание таблиц Гугл умение работать с фильтрами и формулами;</li> <li>Быстрая обучаемость, внимательность, пунктуальность, аккуратность, умение работать с большим объемом данных, вежливость;</li> <li>Знание Битрикс24.</li> </ul> <p><strong>Условия:</strong></p> <ul> <li>Удаленная работа</li> <li>График работы 5/2</li> <li>Корпоративная мобильная связь</li> <li>Официальное оформление по ТК РФ с первого рабочего дня</li> <li>Заработная плата с возможностью роста, зависит от работы с клиентами.</li> </ul> <p> </p> <ul> </ul>",[],https://hh.ru/vacancy/125407954,2025-09-21 21:46:46.313380
125410264,12164809,Head of Recruitment / Руководитель направления подбора персонала,Общество с ограниченной ответственностью О12,Москва,2025-09-16T22:20:28+0300,,,,От 3 до 6 лет,Полная занятость,Полный день,,,,https://hh.ru/vacancy/125410264,2025-09-21 21:46:46.554008
125372239,9131493,Помощник менеджера по маркетплейсам (Ozon),NR-TOYS,Москва,2025-09-16T09:50:52+0300,20000.0,,RUR,От 1 года до 3 лет,Частичная занятость,Удаленная работа,"['Маркетплейсы', 'Контроль отгрузок', 'Сбор и анализ информации', 'Точность и внимательность к деталям', 'Составление отчетности', 'Анализ продаж']","<p><strong>Требования:</strong><br /><br />- Платформа Ozon: структура карточки товара, продвижение товаров, логистика, ценообразование, аналитика основных метрик.<br />- Работа с данными: Excel/Google Sheets — формулы, сводные таблицы, базовая визуализация.<br />- Клиентоориентированность: основные правила коммуникации с покупателями и обработка претензий.</p> <p><strong>Практические умения:</strong></p> <p><br />- Ведение карточек товара: создание карточек и заполнение начиная от названия и заканчивая рич контентом.<br />- Улучшение видимости и позиций товара благодаря SEO оптимизации.<br />- Написание технических заданий дизайнеру.<br />- Аналитика продаж: сбор ежедневной/еженедельной отчётности, выявление аномалий, подготовка предложений по оптимизации.<br />- Коммуникация: взаимодействие со службой поддержки Ozon, покупателями.<br />- Работа с инструментами: личный кабинет Ozon, Битрикс 24, Google Sheets/Excel.</p> <p><strong>Личные качества:</strong></p> <p><br />- Ответственность и аккуратность: внимательность к деталям, аккуратное заполнение данных.<br />- Стрессоустойчивость.<br />- Инициативность: предлагать улучшения, оптимизировать процессы.<br />- Командная работа и коммуникабельность: четкое устное и письменное общение.<br />- Быстрая обучаемость: готовность осваивать новые инструменты и обновления правил маркетплейса.</p>",[],https://hh.ru/vacancy/125372239,2025-09-21 21:46:47.785898
125438909,999442,Аналитик данных/Data analyst,amoCRM,Москва,2025-09-20T13:41:26+0300,,150000.0,RUR,От 1 года до 3 лет,Полная занятость,Полный день,[],"<p><strong>amoCRM</strong> — крупнейшая CRM-система в России. Более 15-ти лет на российском и международном рынке, сотни тысяч клиентов по всему миру. У нас есть офисы в России, Узбекистане, Европе, США и Латинской Америке. Мы помогаем нашим клиентам получать больше лидов, отвечать на сообщения быстрее и делать это автоматически, проводить оплаты, не забывать про встречи, анализировать и увеличивать свои продажи и многое другое.</p> <p>А “за кулисами”, amoCRM — это команда из более 600 энергичных и смелых ребят, которым интересно делать свою работу и важно делать её хорошо.</p> <p>Сейчас мы в поисках <strong>Аналитика данных</strong> в нашу команду.</p> <div><strong>Чем ты будешь заниматься:</strong></div> <ul> <li>Подготовка SQL-запросов и выгрузок для продуктовых и бизнес-команд</li> <li>Построение дашбордов в SupersetАнализ клиентского поведения (retention, churn, воронки)</li> <li>Подготовка исследовательских отчётов для маркетинга и топ-менеджмента</li> </ul> <div>Наш стек: MySQL, Clickhouse, Superset, Amplitude, Excel/Google Sheets, Jira, Python<br /><br /></div> <div><strong>Ты нам подходишь, если у тебя есть:</strong></div> <ul> <li>Опыт работы на схожей позиции от 6 месяцев</li> <li>Умение писать SQL-запросы (join, window functions, CTE, агрегации) и работать с базами данных</li> <li>Владение Excel/Google Sheets на уровне формул и сводных таблиц</li> <li>Опыт работы с BI-инструментами (Superset/Power BI/Tableau/Looker)</li> <li>Понимание продуктовых метрик (retention, churn, ARPU, cohort analysis)</li> <li>Знание основ статистики и A/B-тестирования</li> </ul> <div><strong>Будет плюсом:</strong></div> <ul> <li>Опыт работы с пайплайнами данных (например, DAG в Airflow)</li> <li>Использование готовых AI-сервисов</li> <li>Навыки разработки простых ML-моделей для анализа данных</li> </ul> <div><strong>Условия:</strong></div> <ul> <li>Офисный формат работы в центре Москвы (м. Добрынинская)</li> <li>Полностью белая заработная плата (по итогам собеседования)</li> <li>Гибкий график с возможностью выбора времени начала рабочего дня</li> <li>Отсутствие дресс-кода и лишней бюрократии — общение на &quot;ты&quot; со всеми сотрудниками</li> <li>Работа без трекеров экрана и строгого контроля времени — мы фокусируемся на результатах</li> <li>50% компенсации питания в офисе и другие корпоративные скидки</li> <li>Быстрое профессиональное развитие, возможность предложить и реализовать собственные идеи</li> </ul> <div><br /><strong>Откликайся, если ты хочешь стать частью большого продукта, технически сильной команды, расти и развиваться вместе с нами! Ждем твое резюме)</strong></div>",[],https://hh.ru/vacancy/125438909,2025-09-21 21:46:48.012589
125211791,9498112,Медиааналитик,Яндекс Крауд,Москва,2025-09-16T13:22:02+0300,70000.0,,RUR,Нет опыта,Полная занятость,Удаленная работа,[],"<p>Помогайте сервисам Яндекса формировать маркетинговые стратегии, наблюдать за трендами и грамотно взаимодействовать с аудиторией</p> <p><strong>Какие задачи вас ждут</strong></p> <ul> <li>Работать в системах мониторинга СМИ и социальных сетей: создание запросов разной сложности, настройка фильтров</li> <li>Готовить регулярные, разовые информационно-аналитические отчеты и формировать содержательные выводы на основе данных</li> <li>Размечать и анализировать данные, инфоповоды и темы</li> <li>Коммуницировать с заказчиками в рамках запуска и подготовки отчетов</li> <li>Проводить масштабные медиаисследования — самостоятельно и вместе с командой</li> <li>Участвовать в запуске новых аналитических продуктов и сервисов</li> </ul> <p><strong>Мы ждём, что вы</strong></p> <ul> <li>Работали медиааналитиком от полугода</li> <li>Работали с системами Brand Analytics и/или Медиалогия, или аналогичными системами парсинга СМИ и социальных сетей</li> <li>Знаете суть ключевых метрик, используемых для анализа СМИ и социальных сетей, понимаете принцип построения поисковых запросов</li> <li>Знаете английский на уровне B1 - будет плюсом</li> <li>Работали с зарубежными системами мониторинга и аналитики медиа - будет плюсом</li> </ul> <p><strong>Для работы потребуются</strong></p> <ul> <li>Компьютер с операционной системой Windows 10 или macOS версии 10.12 и выше</li> <li>Стабильное интернет-соединение со скоростью не менее 20 Мбит/с</li> <li>Смартфон или планшет с операционной системой Android 6 или iOS 15.0 и выше</li> </ul> <p><strong>Что мы предлагаем</strong></p> <ul> <li>Официальное трудоустройство, полную занятость</li> <li>Удалённую работу и график 5/2 в промежутке с 10:00 до 19:00 часов по Москве (обсуждается для регионов в других часовых поясах)</li> <li>Стабильный доход, средний уровень которого при полной занятости — 70 000 рублей (на руки). Есть квартальная премия — 45 000 рублей (на руки) при выполнении KPI</li> <li>Возможности роста и развития</li> <li>Оплату больничных и отпусков</li> <li>Онлайн-консультации врачей и страхование от несчастных случаев (доступны через 3 и 6 месяцев соответственно)</li> <li>Компенсацию затрат на электричество и интернет</li> <li>Скидки от партнёров и на продукты Яндекса</li> <li>Дружную и активную команду, которая всегда поможет и подбодрит мемами в чате</li> </ul>",[],https://hh.ru/vacancy/125211791,2025-09-21 21:46:48.301040
125374733,553714,Java-разработчик (Senior),Notamedia,Москва,2025-09-16T10:19:37+0300,,,,От 3 до 6 лет,Полная занятость,Удаленная работа,"['Java', 'Spring Framework', 'REST API']","<p><strong>Notamedia</strong> — аккредитованный ИТ-холдинг, один из лидеров рынка заказной разработки и интеграции. 2004 года мы помогаем бизнесу и государству быть на шаг впереди в цифровом мире<br /><br /><strong>Наши проекты</strong> — это решения, которыми миллионы людей пользуются каждый день: портал mos.ru, МСП.РФ, мобильное приложение &quot;Госуслуги Культура&quot; и многие другие, все проекты имеют социально-значимую направленность. Мы создаем технологии, которые автоматизируют критическую инфраструктуру Правительства Москвы, а также решения для лидеров рынка — Сибур, Jaguar&amp;Land Rover, AURUS, IBS, ВТБ, Capital Group и др. В нашем портфолио более 650 проектов и свыше 250 наград, а также первые позиции в ведущих рейтингах. Всё это стало возможным благодаря команде из 400+ профессионалов в области разработки, аналитики, дизайна и менеджмента.</p> <p><strong>Проект: </strong>Модуль аналитики — это аналитическое решение, созданное для обработки и анализа данных из системы документооборота Модуль направлен на сбор, структурирование и глубокий анализ данных, предоставляя пользователям актуальную и детализированную информацию для эффективного управления документооборотом.</p> <p>Разработка и поддержка аналитического портала с большим объемом данных, на проекте на беке используется стек Java, Groovy, Kotlin, Shell, Python.</p> <p><strong>Задачи, которые предстоит решать:</strong></p> <ul> <li> <p>Оптимизация высоконагруженного проекта</p> </li> <li> <p>Поддержка текущего функционала</p> </li> <li> <p>Доработка нового функционала</p> </li> <li> <p>Работа с архитектурой</p> </li> <li> <p>Взаимодействие с командой для решения технических задач</p> </li> </ul> <p><strong>Что мы ожидаем:</strong></p> <ul> <li> <p>Опыт работы с java от 4х лет;</p> </li> <li> <p>Понимание устройства REST API;</p> </li> <li> <p>Опыт работы с PostgreSQL, ClickHous;</p> </li> <li> <p>Знание SQL;</p> </li> <li> <p>Знаешь принципы разработки HTTP или JSON API;</p> </li> <li> <p><strong>Хорошее знание Spring Framework (Spring Boot, Spring Data, Spring Security);</strong></p> </li> <li> <p><strong>Знание и опыт работы с брокерами очередей (Kafka, RabbitMQ);</strong></p> </li> <li>Уверенное знание средств отладки, средств;<br />обработки ошибок, защиты от уязвимостей, SOLID, KISS, DRY;</li> <li><strong>Умение писать чистый, поддерживаемый код.</strong></li> </ul> <p><strong>Что мы предлагаем:</strong></p> <ul> <li><strong>мы ценим ваш опыт и готовы обсуждать условия дохода по итогам личной встречи;</strong></li> <li><strong>формат и график работы: </strong>удаленно, а офис в Москве, рядом с м. Алексеевская; начало рабочего дня с 9:00 до 11:00 мск</li> <li><strong>проекты федерального масштаба и быстрый рост: </strong>возможность участвовать в крупных проектах, быстро видеть результаты своей работы и расти в должности</li> <li><strong>забота о здоровье: </strong>дмс со стоматологией после года работы, дополнительные 9 sick days в год с первого дня работы</li> <li><strong>крутая команда и поддержка: </strong>в командах Ноты комфортно работать и легко расти, мы поможем быстро влиться и прокачать экспертизу благодаря опытным наставникам и системе грейдов</li> <li><strong>обучение: </strong>компенсируем 50% стоимости дополнительного обучения и оплатим участие в конференциях, если хочешь выступать спикером</li> <li><strong>демократичность и отсутствие бюрократии:</strong> все процессы автоматизируем, быстро принимаем решения, ставим понятные задачи, открыто обсуждаем проблемы и внедряем изменения</li> <li><strong>атмосфера и корпоративы: </strong>вместе отдыхаем на выездных корпоративах и тематических вечеринках в офисе (а для сотрудников из регионов оплачиваем перелет и проживание на корпоративах) и участвуем в спортивных и киберспортивных мероприятиях</li> <li><strong>стабильность: </strong>работа в аккредитованной IT-компании с 20-ти летней историей — ит-ипотека, отсрочка от армии (для военнообязанных)</li> </ul>",[],https://hh.ru/vacancy/125374733,2025-09-21 21:46:48.524229
