id,employer_id,name,employer,area,published_at,salary_from,salary_to,salary_currency,experience,employment,schedule,key_skills,description,specializations,url,fetched_at
124887500,703850,Java Developer (middle),Московский филиал АО ЦентрИнформ,Москва,2025-09-19T16:53:38+0300,200000.0,,RUR,От 3 до 6 лет,Полная занятость,Полный день,[],"<p><em>Мы Российская IT-компания, <strong>аккредитованная в Минцифры,</strong> специализирующаяся на разработке высокопроизводительных программных решений и информационных систем федерального уровня и реализующая передовые идеи с помощью новейших подходов и технологий.</em></p> <p><em>Мы расширяем направление по разработке высоконагруженной системы потоковой обработки и передачи больших данных, которые используются для построения бизнес-процессов, аналитики и проверки гипотез в машинном обучении. Мы используем современные подходы к разработке на основе Java, Python, kafka, Spark, Clickhouse, Vertica . Мы используем гибкие методологии и DevOps для создания инфраструктуры и постоянно обновляем технологический стек (Gradle, GitLab, Jenkins, Nexus, Docker, Hubernate ).</em></p> <p><em>Вы будете работать в команде единомышленников, мотивированных на результат. Ежедневная работа будет включать разработку новых и поддержку существующих микросервисов, взаимодействие внутри команды, а также участие в проектировании архитектуры системы.</em></p> <p><em><strong>При отклике просьба указывать желаемую зарплату</strong></em></p> <p><strong>Мы ожидаем:</strong></p> <p>· Уверенное знание Java 11 и современных фреймворков (Spring Boot);<br />· Ясное представление того, чем хороший код отличается от плохого;<br />· Опыт использования SQL и NOSQL баз данных (Postgres, Redis);<br />· Знание основ работы с распределёнными брокерами сообщений (Kafka);<br />· Общее представление о CI/CD инструментах (Gradle, GitLab, Jenkins, Nexus, Docker, Kubernetes).</p> <p><strong>Вы получаете:</strong></p> <p>Интересную работу с возможностью профессионального роста в стабильной российской компании (крупный системный интегратор в области информатизации и защиты информации) с ИТ-проектами федерально масштаба;</p> <p>Дружный коллектив квалифицированных сотрудников;</p> <p>Удобное расположение офиса: в районе ст. м. Нагатинская, Каширская, Коломенская. Офис кабинетного типа.</p> <p>График - <strong>ГИБРИД</strong> (ПОЛНОСТЬЮ УДАЛЕННЫЙ ФОРМАТ СОТРУДНИЧЕСТВА <strong>НЕ РАССМАТРИВАЕМ</strong>): вторник, четверге в офисе, остальные дни удаленно.</p> <p>Официальную заработную плату, оформление по ТК РФ с первого рабочего дня;</p> <p>Премия по итогам года;</p> <p>Гибкое начало рабочего дня, пятидневка;</p> <p>Оформление по ТК;</p> <p>Обучение за счет компании (Отус, Яндекс-практикум, Skillbox и др.);</p> <p>Удобная кухня, кофе-поинты, регулярные корпоративные мероприятия.</p>",[],https://hh.ru/vacancy/124887500,2025-09-21 21:47:17.714077
125390206,6237,Бизнес-аналитик,НИЦ КУРЧАТОВСКИЙ ИНСТИТУТ,Москва,2025-09-16T13:59:22+0300,200000.0,,RUR,От 3 до 6 лет,Полная занятость,Полный день,"['Бизнес-анализ', 'Анализ данных', 'Автоматизация бизнес-процессов', 'Описание бизнес-процессов']","<strong>Обязанности:</strong> <ul> <li> <p>Сбор и анализ данных о бизнес-процессах организации;</p> </li> <li> <p>Систематизация взаимодействия и интеграции различных информационных систем организации;</p> </li> <li> <p>Описание и документирование бизнес-процессов;</p> <p>Формирование требований и технических заданий для разработчиков, декомпозирование задач;</p> </li> <li> <p>Поддержка и обновление документации проекта;</p> <p>Подготовка презентаций, подготовка материалов к совещаниям, ведение протоколов совещаний;</p> </li> <li> <p>Ведение деловой переписки и формирование аналитических справок по запросу руководства.</p> </li> </ul> <p> </p> <p><strong>Требования:</strong></p> <ul> <li>высшее профессиональное образование;</li> <li> <p>Базовые знания в сфере управления проектами;</p> </li> <li> <p>Готовность к чтению технической и нормативной документации;</p> </li> <li> <p>Знания в области анализа и моделирования бизнес-процессов;</p> <p>Аналитический склад ума, внимательность к деталям, ответственность;</p> </li> <li> <p>Коммуникабельность, умение и желание работать в команде, бесконфликтность;</p> </li> <li> <p>Системное мышление, умение выделять главное и расставлять приоритеты.</p> </li> </ul> <p> </p> <p><strong>Условия:</strong></p> <ul> <li>оформление по ТК РФ;</li> <li>основное место работы;</li> <li>пятидневная рабочая неделя с 09.00 до 18.00, пятница с 09.00 до 16.45, обед с 13.00 до 13.45, отпуск 28 к.дн.;</li> <li> <p>закрытая охраняемая территория;</p> </li> <li> <p>стабильная заработная плата;</p> </li> <li> <p>базовое медицинское обслуживание (поликлиника на территории НИЦ &quot;Курчатовский институт&quot;).</p> </li> </ul>",[],https://hh.ru/vacancy/125390206,2025-09-21 21:47:17.916515
125458046,798923,Project manager,VOXYS,Москва,2025-09-18T06:02:21+0300,,,,От 3 до 6 лет,Полная занятость,Удаленная работа,"['Project management', 'Управление командой', 'Анализ данных', 'A/B тесты', 'Customer Journey Mapping', 'Big Data', 'CRM', 'RFM-анализ']","<strong>Обязанности:</strong> <ul> <li>Управление проектами: полный цикл ведения проектов (инициация, планирование, исполнение, контроль, закрытие) в области Big Data и аналитики;</li> <li>Работа с командой: формирование, мотивация и операционное управление кросс-функциональной командой разработки;</li> <li>Внедрение решений: организация процессов внедрения новых функций и моделей в формате roll-out и пилотных проектов, включая планирование, тестирование и оценку результатов;</li> <li>Аналитика и метрики: разработка, выстраивание и мониторинг performance-метрик команды и проектов для оценки их эффективности и влияния на бизнес-показатели;</li> <li>Исследовательская деятельность: проведение и интерпретация корреляционного анализа и других статистических методов для выявления скрытых зависимостей в данных;</li> <li>Работа с данными: глубокая работа с данными в области &quot;Знания о клиенте&quot; (Customer Intelligence) для сегментации, прогнозирования поведения и персонализации взаимодействия;</li> <li>Взаимодействие с рынком: анализ рынка каналов дистрибуции (маркетинговых, sales-каналов) и понимание принципов их регулирования для корректной интеграции data-решений.</li> </ul> <strong>Требования:</strong> <ul> <li>Опыт работы на позиции Project manager / Менеджера проектов от 3-х лет в сфере Big Data, Data Science или advanced-аналитики;</li> <li>Опыт управления командами от 3-х человек;</li> <li>Глубокое понимание области &quot;Знания о клиенте&quot;: сегментация клиентской базы (RFM, CLV), прогнозное моделирование поведения, атрибуция и анализ клиентского пути (Customer Journey);</li> <li>Практический опыт работы с BI-инструментами (Tableu, Power BI, Qlik, Redash) и понимание принципов построения дашбордов;</li> <li>Опыт взаимодействия с AI-агентами и чат-ботами (как с инструментами автоматизации, так и с продуктами для внедрения);</li> <li>Навыки проведения корреляционного анализа, A/B-тестирования и работы с гипотезами;</li> <li>Опыт внедрения решений (roll-out) и проведения пилотных проектов;</li> <li>Понимание воронок продаж, каналов привлечения и удержания клиентов и их метрик;</li> <li>Высшее образование (техническое, математическое, экономическое или смежное);</li> <li>Сильные лидерские качества, отличные коммуникативные навыки и умение говорить на одном языке с техническими специалистами и бизнес-заказчиками;</li> <li>Системное и аналитическое мышление, ориентация на данные (Data-driven approach) в принятии решений.</li> </ul> <p><strong>Вашим преимуществом будет:</strong></p> <ul> <li>Опыт работы с системами CRM / CBM (Customer Base Management) / CVM (Customer Value Management);</li> <li>Понимание принципов и опыт реализации проектов в области HR-Tech (например, прогнозная аналитика текучести кадров, автоматизация процессов рекрутинга, анализ эффективности сотрудников).</li> </ul> <strong>Условия:</strong> <ul> <li> <p>Своевременная &quot;белая&quot; заработная плата (2 раза в месяц на банковскую карту);</p> </li> <li> <p>Официальное трудоустройство и социальные гарантии с первого дня работы;</p> </li> <li> <p>Удаленный формат работы;</p> </li> <li> <p>График работы 5-дневка с 9.00 до 18.00 Мск;</p> </li> <li>Работа в команде профессионалов над сложными и интересными задачами;</li> <li>Корпоративные программы: скидки от компаний партнеров.</li> </ul>",[],https://hh.ru/vacancy/125458046,2025-09-21 21:47:18.238232
125410021,11692887,Head of Product / CPO / VP Product,Star Leads,Москва,2025-09-19T21:28:35+0300,5000.0,,USD,От 3 до 6 лет,Полная занятость,Удаленная работа,[],"<p><strong>Star Leads Traffic Media</strong> - это международное медиабаинговое агентство, работающее в вертикалях FinTech, EdTech, Инфобиз с собственным продюсерским центром. Мы являемся международным холдингом, работаем на рынке более 5 лет и представлены в более чем 50 странах мира, от Латинской Америки до Африки.</p> <p><strong>Мы ищем результативного Директора по продукту (CPO)</strong>, который возьмет на себя полную ответственность за продуктовую стратегию, развитие и монетизацию. Вы будете работать в паре с CTO и возглавите продуктовую функцию, трансформируя глубокое понимание рынка и данных в четкий и исполняемый план.<br /><br /><strong>Чем предстоит заниматься:</strong></p> <ul> <li>Разработка и исполнение всеобъемлющей продуктовой стратегии и видения, основанной на данных и глубоком понимании рынка.</li> <li>Руководство продуктовой командой (продукт-менеджеры, аналитики, дизайнеры).</li> <li>Формирование и приоритизация продуктового бэклога, дорожной карты (Roadmap) на основе анализа метрик, юзер-ресерча и бизнес-целей.</li> <li>Определение ключевых метрик продукта (North Star, LTV, CAC, Engagement) и постоянный мониторинг эффективности принимаемых решений.</li> <li>Тесная интеграция с техническими командами (бэкенд, фронтенд, AI/ML) для обеспечения корректной реализации сложных фич, особенно связанных с AI и LLM.</li> <li>Построение и оптимизация процессов продуктового менеджмента на всех этапах жизненного цикла продукта.</li> <li>Анализ конкурентной среды и рыночных трендов в сферах FinTech, Social Media, AdTech.</li> <li>Взаимодействие с ключевыми стейкхолдерами (менеджмент, инвесторы, коммерция).</li> </ul> <p><strong>Ключевые требования (must have):</strong></p> <p> </p> <ul> <li>Опыт работы от 5 лет в продукте, из них 3+ года на руководящей роли (Head of Product, CPO, VP Product) в IT-компаниях с высоконагруженными продуктами (предпочтение кандидатам из FinTech, соцсетей, AdTech, Marketplace).</li> <li>Опыт работы с продуктами, где технологии и данные — ключевой драйвер роста. Понимание принципов работы высоконагруженных систем, чтобы эффективно коммуницировать с техническими командами.</li> <li>Практический опыт запуска и развития продуктовых фич или целых продуктов, использующих AI/ML, в частности Large Language Models (LLM). Понимание, какую пользовательскую проблему решает AI и как измерить его эффективность.</li> <li>Навык управления продуктовыми командами от 5+ человек (продукт-менеджеры, аналитики).</li> <li>Сильные аналитические навыки: уверенная работа с данными (SQL, Amplitude, Mixpanel, Tableau), опыт проведения A/B тестов, приоритизация на основе данных.</li> <li>Опыт полного цикла управления продуктом: от генерации гипотез и юзер-ресерча до запуска, анализа результатов и итераций.</li> <li>Навык работы с фреймворками приоритизации (RICE, WSJF и др.).</li> </ul> <p><strong>Будет преимуществом (nice to have):</strong></p> <p> </p> <ul> <li>Техническое образование или опыт работы на инженерных ролях в прошлом.</li> <li>Опыт построения продукта с нуля (zero-to-one).</li> <li>Опыт работы в продуктах с моделью монетизации B2C.</li> <li>Навыки публичных выступлений, опыт презентации продукта инвесторам.</li> </ul> <p><strong>Что мы предлагаем:</strong></p> <ul> <li><strong>Достойный уровень оплаты.</strong> Ориентируемся на ваши ожидания;</li> <li><strong>Полностью удаленный формат работы.</strong> Возможность работать из любой точки мира;</li> <li><strong>Свободу</strong> и поддержку;</li> <li><strong>Классный коллектив. </strong>Mы за систему и процессы, но против бюрократии. Строго спрашиваем результат, но даём карт бланш в способе достижения;</li> <li><strong>Профессиональный и личностный рост </strong>внутри компании. Сотрудники — как наши клиенты: мы их искренне любим, ценим и готовы делать так, чтобы с каждым днём команда становилась лучше.</li> </ul>",[],https://hh.ru/vacancy/125410021,2025-09-21 21:47:18.522913
125494989,2575,Системный аналитик,Бэнкс Софт Системс,Москва,2025-09-18T16:31:27+0300,,,,От 3 до 6 лет,Полная занятость,Удаленная работа,[],"<p>Системный аналитик на проект 3 месяца (СТД)</p> <p><strong>Banks Soft Systems</strong> - системно значимая российская ИТ-компания, специализирующаяся на разработке, внедрении и поддержке решений по цифровизации клиентского обслуживания для банков, финтех-компаний, госсектора, телекома, ритейла, медицины, сферы ЖКХ в России и СНГ. Мы разрабатываем системы речевой аналитики, развиваем платформы дистанционного банковского обслуживания, а также оказываем услуги по заказной и аутсорс разработке. Мы практикуем наиболее востребованные рынком технологические решения: от машинного обучения до разработки 1С.<br /><br />Сейчас мы находимся в поиске <strong>системного аналитика</strong> на проект к нашему заказчику.<br /><br />Проект:</p> <p>Объединяющий портал для вывода собственных платформенных решений MWS и партнерских технологических сервисов, а так же доставки решений клиенту, включая в себя единый UI и общие компоненты (IAM, учет потребления, биллинг, документацию и т.д.)</p> <strong>Обязанности:</strong> <ul> <li> <p>Анализировать бизнес-требования, разрабатывать и согласовывать системные требования, описания протоколов и API сервисов;</p> </li> <li> <p>Анализировать и декомпозировать задачи на разработку, заниматься постановкой задач и контролем скорости и качества их реализации;</p> </li> <li> <p>Согласовывать требования для интеграции со смежными системами;</p> </li> <li> <p>Заниматься поиском и проработкой не типовых подходов к решению сложных задач;</p> </li> <li> <p>Разрабатывать структуры хранения данных;</p> </li> <li> <p>Участие во всех процессах команды, в том числе и в релизном цикле;</p> </li> <li> <p>Формирование ADR.</p> </li> </ul> <strong>Требования:</strong> <ul> <li> <p>Опыт работы с Jira и Confluence;</p> </li> <li> <p>Знание принципов микросервисной архитектуры;</p> </li> <li> <p>Практический опыт использования SQL;</p> </li> <li> <p>Опыт применения нотаций UML и BPMN;</p> </li> <li> <p>Глубокие знания в технологиях REST, GraphQL, SAOP, MQ, Kafka, gRPC и Protobuf;</p> </li> <li> <p>Опыт работы с форматами обмена данными XML/XSD, JSON;</p> </li> <li> <p>Понимание важности нефункциональных требований и умение их описывать;</p> </li> <li> <p>Знание PlantUML, Markdown;</p> </li> <li> <p>Знание английского языка на уровне достаточном для чтения тех. документации;</p> </li> <li> <p>Умение работать в большой, кроссфункиональной команде;</p> </li> <li> <p>Умение давать обратную связь;</p> </li> <li> <p>Ориентированность на результать, целеустремленность;</p> </li> <li> <p>Усидчивость, ответсвенность, дружелюбность, активность;</p> </li> <li> <p>Английский intermediate и выше - чтение технической документации;</p> </li> <li> <p>Опыт работы с Confluence/Wiki;</p> </li> <li> <p>Опыт работы в системах управления задачами (Jira, Azure или др.);</p> </li> <li> <p>Опыт работы по методологии Agile, Scrum.</p> </li> </ul> <strong>Условия:</strong> <ul> <li>Достойный уровень заработной платы (обсуждаем на собеседовании);</li> <li>Удаленный формат работы по РФ;</li> <li>Предоставляем всю необходимую технику для работы.</li> </ul>",[],https://hh.ru/vacancy/125494989,2025-09-21 21:47:18.762218
