id,employer_id,name,employer,area,published_at,salary_from,salary_to,salary_currency,experience,employment,schedule,key_skills,description,specializations,url,fetched_at
124729657,2942396,Системный аналитик в IT,СтандартПроект,Москва,2025-09-01T18:01:13+0300,,,,От 1 года до 3 лет,Полная занятость,Полный день,['Системный анализ'],"<p>Привет! Мы команда единомышленников и профессионалов СтандартПроект, создаем уникальные, востребованные и современные IT решения в двух ключевых направлениях: фото\видео фиксации и распознавании лиц. У нас огромный опыт перевода процессов в цифровой мир. Мы участвуем в обеспечении бесперебойного функционирования государственных информационных систем, а наши проекты обеспечивают безопасность по всей территории России.</p> <p>✔️ Резиденты Сколково<br />✔️ ИТ-компания, аккредитованная Министерством цифрового развития, связи и массовых коммуникаций Российской Федерации</p> <p>Приглашаем на работу в нашу команду <strong>системного аналитика.</strong></p> <p><strong>Вашими основными задачами будут:</strong></p> <ul> <li>Анализ требований заказчика, изучение документации на системы, изучение функциональности систем;</li> <li>Выявление неполноты, противоречий в требованиях, формирование вопросов для уточнения требований;</li> <li>Сбор недостающей информации, проведение интервью, уточнение требований;</li> <li>Согласование проектных документов с внутренними заказчиками;</li> <li>Формирование в таск-менеджере задач на разработку;</li> <li>Консультации разработчиков, тестировщиков по вопросам, возникающим в процессе разработки, тестирования системы.</li> </ul> <p><strong>Ожидаем от вас:</strong></p> <ul> <li>Опыт описания функциональных требований на разработку программного обеспечения от 1 года;</li> <li>Высшее образование (техническое предпочтительно);</li> <li>Понимание основ реляционных баз данных и SQL, BPMN, UML схема;</li> <li>Базовые знания архитектуры систем;</li> <li>Умение анализировать и синтезировать информацию.</li> </ul> <p><strong>Мы предлагаем:</strong></p> <ul> <li>Достойную заработную плату, ежемесячные и годовые премии, официальное оформление в соответствии с ТК РФ;</li> <li>Интересную предметную область и сложные технические задачи, действительно уникальный опыт, который мало где можно получить;</li> <li>Работу над реальными проектами, которые на слуху у всех;</li> <li>Гибкое начало работы (старт 08.00 – 10.00);</li> <li>График работы: 5/2, СБ и ВС, праздники - выходные дни;</li> <li>Полис ДМС;</li> <li>Корпоративное питание в офисе;</li> <li>Офис рядом с метро Таганская, БЦ Фабрика Станиславского;</li> <li>Работу в команде высококлассных и дружных специалистов.</li> </ul>",[],https://hh.ru/vacancy/124729657,2025-09-21 21:46:25.216968
125504633,,Директор по продажам/Коммерческий директор (FMCG),"Федеральный производитель продуктов питания, один из лидеров в своем сегменте",Москва,2025-09-18T23:41:15+0300,1000000.0,,RUR,Более 6 лет,Полная занятость,Полный день,"['Стратегия продаж', 'Работа с федеральными сетями', 'B2C продажи', 'Управление продажами', 'Управление отношениями с клиентами', 'Аналитика продаж', 'Оптимизация бизнес-процессов', 'Развитие продаж', 'Управление работой с ключевыми клиентами', 'Мотивация персонала']","<p><strong>Директор по продажам/Коммерческий директор (FMCG / Продукты питания)</strong></p> <p><em>Федеральный производитель продуктов питания, один из лидеров в своем сегменте. Мы ищем в свою команду руководителя, который возглавит нашу экспансию и выведет продажи на новый уровень.</em></p> <p><strong>Ключевые задачи:</strong></p> <ul> <li>Разработка и реализация стратегии развития продаж на федеральном уровне.</li> <li>Разработка и реализация коммерческой политики во всех каналах сбыта.</li> <li>Управление и развитие продаж во всех каналах сбыта: федеральные сети, региональные сети, дистрибуторы, маркетплейсы.</li> <li>Формирование и контроль выполнения плана продаж, бюджета департамента.</li> <li>Развитие долгосрочных и прибыльных отношений с ключевыми клиентами.</li> <li>Руководство, мотивация и развитие команды департамента продаж (структура департамента продаж – более 100 чел).</li> <li>Оптимизация системы KPI и бизнес-процессов в департаменте продаж.</li> <li>Анализ рынка, конкурентной среды и поиск новых точек роста для бренда.</li> <li>Оптимизация информационных и CRM-систем в департаменте продаж.</li> </ul> <p><strong>Наши ожидания от кандидата:</strong></p> <ul> <li>Рассматриваем кандидатов ТОЛЬКО из крупных федеральных компаний (продукты питания, FMCG)</li> <li>Опыт успешной работы в должности Директора по продажам по продажам <strong>от 5 лет в сфере FMCG (продукты питания)</strong>.</li> <li>Наличие подтвержденных деловых контактов с крупными федеральными и региональными торговыми сетями.</li> <li>Успешный опыт управления командой от 100 человек, мотивации и построения разветвленных систем KPI.</li> <li>Глубокое понимание процессов FMCG-ритейла, мерчендайзинга, условий эффективного промо.</li> <li>Сильные аналитические навыки, умение работать с большими массивами данных (Excel, BI-системы).</li> <li>Стратегическое мышление, нацеленность на результат и умение принимать сложные решения.<br /><br /><strong>Мы предлагаем:</strong></li> </ul> <ul> <li><strong>Высокий уровень дохода:</strong> <strong>оклад + квартальный бонус + годовая премия.</strong><br />На собеседовании обсудим ваши ожидания и наши возможности.</li> <li>Ключевую роль в компании и возможность напрямую влиять на бизнес-результаты.</li> <li>Оформление по ТК РФ, полный социальный пакет.</li> <li>Современный офис, корпоративная техника.</li> </ul>",[],https://hh.ru/vacancy/125504633,2025-09-21 21:46:25.428748
125563298,6030188,Исполнительный директор (CEO),Careerexpert,Москва,2025-09-20T23:37:59+0300,300000.0,400000.0,RUR,Более 6 лет,Полная занятость,Полный день,"['Управление командой', 'Оптимизация бизнес-процессов', 'Оптимизация затрат', 'Анализ бизнес показателей', 'Бюджетирование', 'Управление эффективностью', 'Управление затратами', 'Лидерство']","<p>Агентство маркетинговых коммуникаций, осуществляющее всестороннюю поддержку крупных торговых марок на рынке РФ и в странах ближнего зарубежья.</p> <p>Компания предоставляет комплексные услуги в области маркетинга в ритейле.</p> <p><strong>Мы ищем:</strong></p> <p>Опытного и стратегически мыслящего Исполнительного директора компании. Это ключевая позиция с прямым подчинением Генеральному директору.</p> <p>Ключевая роль: обеспечение качества и эффективности реализации проектов компании, развитие услуг компании и смежных сервисов.</p> <p>Ваши ключевые задачи:</p> <p><strong>Операционное управление и контроль: </strong>полный цикл управления отделом воплощения проектов - формирование, оптимизация и контроль исполнения бюджетов реализации проектов.</p> <p><strong>Эффективность</strong>: анализ затрат и разработка мер по их снижению. Обеспечение рентабельности работ, оптимизация прямых расходов по проектам, оптимизация складских услуг и затрат на логистику.</p> <p><strong>Команда и Развитие:</strong></p> <p>Разработка и реализация стратегии развития подотчетных отделов – реализация проектов, производство, логистика и складской комплекс. Формирование сильной команды. Подбор, мотивация и развитие персонала.</p> <p><strong>Аналитика и Отчетность:</strong></p> <p>Организация регулярной аналитической отчетности по всем аспектам работы отдела реализации. Принятие решений на основе данных.</p> <p><strong>Мы ждем от кандидата:</strong></p> <p>Опыт работы:</p> <p>Опыт на руководящих позициях в сфере управления проектами и подразделениями компаний.</p> <p>Доказанный опыт полного цикла управления реализацией масштабных проектов, включая производство, логистику, складские услуги, работы с субподрядчиками.</p> <p>Опыт прямого подчинения первому лицу компании (Генеральному Директору).</p> <p><strong>Технические Навыки:</strong></p> <p>Знание материалов и технологий производства рекламного и торгового оборудования, технологий печати (как преимущество).</p> <p>Понимание складского учета.</p> <p>Свободное владение ПК: Продвинутый MS Excel (сводные таблицы, формулы, анализ), Word, PowerPoint. Опыт работы с 1С.</p> <p><strong>Мы предлагаем:</strong></p> <p>Оформление по ТК РФ, 5/2 с 10.00 до 19.00</p> <p>Фикс 300 тыс. рублей на руки + KPI (совокупный доход 350-400 тыс. рублей)</p> <p>Ключевую роль в компании с прямым подчинением Генеральному директору.</p> <p>Масштабную задачу: полное управление большой командой реализации проектов и более 150 подрядными организациями.</p> <p>Реальную возможность влиять на бизнес-процессы и результат.</p> <p>Место работы: Москва, <strong>офис </strong>- м. Арбатская</p> <p> </p> <p> </p>",[],https://hh.ru/vacancy/125563298,2025-09-21 21:46:25.655461
125143584,5168378,Менеджер по работе с маркетплейсом OZON,Кучер Олег Леонидович,Москва,2025-09-19T11:21:31+0300,70000.0,110000.0,RUR,Нет опыта,Проектная работа,Удаленная работа,"['Аналитика маркетплейсов', 'Аналитическое мышление', 'Анализ ценообразования', 'Маркетплейсы', 'Анализ продаж', 'Анализ рынка', 'Анализ конкурентной среды', 'Анализ данных']","<p>Мы ищем человека, который возьмёт на себя проработку карточек товаров без ограничений в инструментах и подходах.</p> <p><strong>Что предстоит делать:</strong></p> <ul> <li>• <strong>Прокачивать карточки автозапчастей:</strong> название, описание, доп поля, применимость запчасти, SEO, фото, тексты, рич-контент, работа над воронкой и конверсиями - <strong>с целью оптимизации ДРР, и повышения продаж</strong></li> <li>• <strong>Проверять точность информации </strong>о применимости запчасти, искать в интернете</li> <li>• <strong>Анализировать наши карточки и конкурентов</strong>, выдачу, цены и запросы.</li> <li>• <strong>Проверять ставки в рекламных инструментах, </strong>при необходимости регулировать</li> <li>• <strong>Ставить ТЗ дизайнерам</strong>, курировать исполнение и следить за качеством.</li> <li>• <strong>Следить за оборачиваемостью</strong> остатков и вовремя сигнализировать (особенно FBO).</li> <li>• <strong>Ежедневные отчеты </strong>о проделанной работе</li> </ul> <p><strong>Мы ждём человека</strong>, который любит анализировать, находить причинно-следственные связи смотря на воронку, карточку и конкурентов. Здесь ценится не «как именно», а результат и рост продаж. От себя так же готовы рассказать вам все о категории автозапчастей, а так же показать быстрые приемы по анализу и проработке карточек.</p> <p><strong>О компании</strong></p> <p>Мы — молодая и быстрорастущая команда. Работаем на <strong>Wildberries, Ozon, Яндекс Маркет</strong>, развиваем <strong>автозапчасти</strong> 80% ассортимента, товары для дома, инструменты, автотовары и новые категории по спросу.</p> <p>Главное о наших брендах:</p> <ul> <li> <p><strong>Kortex</strong> — автозапчасти, <strong>10 000+ артикулов</strong>, структурировано по <strong>80 однотипным категориям</strong></p> </li> <li> <p><strong>АТ</strong> — товары для дома, спорта и туризма, <strong>~1000 артикулов</strong>, из них <strong>50–80 ключевых позиций</strong> с фокусом на продажи и рекламу</p> </li> </ul> <p>✅ Что мы ожидаем:</p> <ul> <li> <p><strong>Опыт работы с OZON</strong> - желательно от полу года, или пройденные курсы с фокусом на аналитику и продвижение</p> </li> <li> <p><strong>Опыт в улучшении конверсий карточек</strong>, увеличения продаж товара - полная ответственность за результат</p> </li> <li> <p>Практическое знание логики <strong>рекламы и алгоритмов выдачи OZON</strong></p> </li> <li> <p>Навыки в <strong>MPstats, Excel / Google Sheets, </strong>знание внутренних инструментов<strong> OZON Premium plus</strong></p> </li> <li> <p>Умение <strong>анализировать, приоритизировать и системно работать, гибкость мышления</strong></p> </li> </ul> <p>Условия:</p> <ul> <li> <p><strong>Оклад 70 000 ₽ + KPI (после увеличения продаж)</strong></p> </li> <li> <p><strong>График: 5/2</strong>, сб и вс — выходные</p> </li> <li> <p><strong>Проектная работа, или оформление в штат по ТК РФ</strong></p> </li> <li> <p><strong>Удалённый формат</strong></p> </li> <li> <p><strong>Зарплата — 2 раза в месяц</strong>, строго по графику</p> </li> <li> <p>Доступ ко всем инструментам:</p> <ul> <li> <p><strong>WB Джем</strong></p> </li> <li> <p><strong>MPstats</strong> (полный тариф)</p> </li> <li> <p><strong>Ozon Premium Plus</strong></p> </li> <li> <p><strong>Power BI с готовыми дашбордами</strong></p> </li> </ul> </li> <li> <p>‍В штате: <strong>2 дизайнера и фотограф со студией</strong></p> </li> <li> <p>Команда <strong>закупщиков в Китае (Шанхай)</strong></p> </li> <li> <p><strong>Обучение за счёт компании</strong> — курсы, конференции, форумы (например, <strong>COM E-ON</strong>)</p> </li> </ul> <p>Почему стоит к нам:</p> <ul> <li> <p>Спокойная, честная атмосфера</p> </li> <li> <p>Сильная команда и понятные процессы</p> </li> <li> <p>Фокус на развитие, без выгорания</p> </li> </ul> <p>Присылайте отклик — с интересом рассмотрим каждый опыт!</p> <ul> <li> </li> </ul>",[],https://hh.ru/vacancy/125143584,2025-09-21 21:46:25.877064
